miopen_cache/gfx1200_16.HIP.3_5_1_de5c1aebb6.ufdb.txt
9-3-128-128-3x3x3-64-3-128-128-32-1x1x1-1x1x1-1x1x1-0-NCDHW-FP16-F=GemmFwdRest:23.0983,23887872,miopenConvolutionFwdAlgoGEMM;ConvDirectNaiveConvFwd:372.219,0,miopenConvolutionFwdAlgoDirect
64-3-128-128-3x3x3-16-3-128-128-32-1x1x1-1x1x1-1x1x1-0-NCDHW-FP16-F=GemmFwdRest:87.9589,169869312,miopenConvolutionFwdAlgoGEMM;ConvDirectNaiveConvFwd:634.231,0,miopenConvolutionFwdAlgoDirect
64-3-128-128-1x1x1-16-3-128-128-32-0x0x0-1x1x1-1x1x1-0-NCDHW-FP16-F=GemmFwd1x1_0_1:1.39716,0,miopenConvolutionFwdAlgoGEMM;ConvDirectNaiveConvFwd:38.4642,0,miopenConvolutionFwdAlgoDirect
64-3-128-128-1x1x1-64-3-128-128-32-0x0x0-1x1x1-1x1x1-0-NCDHW-FP16-F=GemmFwd1x1_0_1:1.54602,0,miopenConvolutionFwdAlgoGEMM;ConvDirectNaiveConvFwd:144.511,0,miopenConvolutionFwdAlgoDirect
1-3-128-128-3x3x3-64-3-128-128-32-1x1x1-1x1x1-1x1x1-0-NCDHW-FP16-F=GemmFwdRest:4.19407,2654208,miopenConvolutionFwdAlgoGEMM;ConvDirectNaiveConvFwd:40.3461,0,miopenConvolutionFwdAlgoDirect
64-3-128-128-3x3x3-64-3-128-128-32-1x1x1-1x1x1-1x1x1-0-NCDHW-FP16-F_g64=GemmFwdRest:153.214,169869312,miopenConvolutionFwdAlgoGEMM;ConvDirectNaiveConvFwd:40.3439,0,miopenConvolutionFwdAlgoDirect
64-3-128-128-1x1x1-128-3-128-128-32-0x0x0-1x1x1-1x1x1-0-NCDHW-FP16-F=GemmFwd1x1_0_1:2.09489,0,miopenConvolutionFwdAlgoGEMM;ConvDirectNaiveConvFwd:286.759,0,miopenConvolutionFwdAlgoDirect
64-3-128-128-3x3x3-64-3-128-128-32-1x1x1-1x1x1-1x1x1-0-NCDHW-FP16-F=GemmFwdRest:89.7085,169869312,miopenConvolutionFwdAlgoGEMM;ConvDirectNaiveConvFwd:2435.41,0,miopenConvolutionFwdAlgoDirect
64-3-128-128-1x1x1-32-3-128-128-32-0x0x0-1x1x1-1x1x1-0-NCDHW-FP16-F=GemmFwd1x1_0_1:1.5306,0,miopenConvolutionFwdAlgoGEMM;ConvDirectNaiveConvFwd:111.745,0,miopenConvolutionFwdAlgoDirect
64-3-128-128-3x3x3-1-3-128-128-32-1x1x1-1x1x1-1x1x1-0-NCDHW-FP16-F=GemmFwdRest:92.0401,169869312,miopenConvolutionFwdAlgoGEMM;ConvDirectNaiveConvFwd:64.137,0,miopenConvolutionFwdAlgoDirect
1-128-128-11x11-1-128-128-96-5x5-1x1-1x1-0-NCHW-FP16-F=GemmFwdRest:6.34297,3964928,miopenConvolutionFwdAlgoGEMM;ConvDirectNaiveConvFwd:6.5263,0,miopenConvolutionFwdAlgoDirect
1-132-132-5x5-1-128-128-96-0x0-1x1-1x1-0-NCHW-FP16-F=GemmFwdRest:4.19194,819200,miopenConvolutionFwdAlgoGEMM;ConvDirectNaiveConvFwd:1.38866,0,miopenConvolutionFwdAlgoDirect
1-128-128-5x5-1-132-132-96-0x0-1x1-1x1-0-NCHW-FP16-B=GemmBwdRest:4.74198,819200,miopenConvolutionBwdDataAlgoGEMM;ConvDirectNaiveConvBwd:2.14065,0,miopenConvolutionBwdDataAlgoDirect
1-128-128-11x11-1-128-128-96-5x5-1x1-1x1-0-NCHW-FP16-B=GemmBwdRest:7.84972,3964928,miopenConvolutionBwdDataAlgoGEMM;ConvDirectNaiveConvBwd:9.26427,0,miopenConvolutionBwdDataAlgoDirect
1-3-128-128-3x3x3-64-3-128-128-32-1x1x1-1x1x1-1x1x1-0-NCDHW-FP16-B=GemmBwdRest:57.3602,169869312,miopenConvolutionBwdDataAlgoGEMM;ConvDirectNaiveConvBwd:97.3881,0,miopenConvolutionBwdDataAlgoDirect
1-3-128-128-3x3x3-64-3-128-128-32-1x1x1-1x1x1-1x1x1-0-NCDHW-FP16-W=GemmWrwUniversal:93.187,169869312,miopenConvolutionBwdWeightsAlgoGEMM;ConvDirectNaiveConvWrw:3413.29,0,miopenConvolutionBwdWeightsAlgoDirect
64-3-128-128-3x3x3-64-3-128-128-32-1x1x1-1x1x1-1x1x1-0-NCDHW-FP16-B=GemmBwdRest:56.8502,169869312,miopenConvolutionBwdDataAlgoGEMM;ConvDirectNaiveConvBwd:4117.24,0,miopenConvolutionBwdDataAlgoDirect
64-3-128-128-3x3x3-64-3-128-128-32-1x1x1-1x1x1-1x1x1-0-NCDHW-FP16-W=GemmWrwUniversal:96.613,169869312,miopenConvolutionBwdWeightsAlgoGEMM;ConvDirectNaiveConvWrw:3461.69,0,miopenConvolutionBwdWeightsAlgoDirect
64-3-128-128-1x1x1-64-3-128-128-32-0x0x0-1x1x1-1x1x1-0-NCDHW-FP16-B=GemmBwd1x1_stride1:1.61403,0,miopenConvolutionBwdDataAlgoGEMM;ConvDirectNaiveConvBwd:263.27,0,miopenConvolutionBwdDataAlgoDirect
64-3-128-128-1x1x1-64-3-128-128-32-0x0x0-1x1x1-1x1x1-0-NCDHW-FP16-W=GemmWrw1x1_stride1:12.39,0,miopenConvolutionBwdWeightsAlgoGEMM;ConvDirectNaiveConvWrw:334.079,0,miopenConvolutionBwdWeightsAlgoDirect
32-3-128-128-1x1x1-64-3-128-128-32-0x0x0-1x1x1-1x1x1-0-NCDHW-FP16-B=GemmBwd1x1_stride1:1.34969,0,miopenConvolutionBwdDataAlgoGEMM;ConvDirectNaiveConvBwd:132.104,0,miopenConvolutionBwdDataAlgoDirect
32-3-128-128-1x1x1-64-3-128-128-32-0x0x0-1x1x1-1x1x1-0-NCDHW-FP16-W=GemmWrw1x1_stride1:22.894,0,miopenConvolutionBwdWeightsAlgoGEMM;ConvDirectNaiveConvWrw:537.745,0,miopenConvolutionBwdWeightsAlgoDirect
128-3-128-128-1x1x1-64-3-128-128-32-0x0x0-1x1x1-1x1x1-0-NCDHW-FP16-B=GemmBwd1x1_stride1:2.13291,0,miopenConvolutionBwdDataAlgoGEMM;ConvDirectNaiveConvBwd:532.1,0,miopenConvolutionBwdDataAlgoDirect
128-3-128-128-1x1x1-64-3-128-128-32-0x0x0-1x1x1-1x1x1-0-NCDHW-FP16-W=GemmWrw1x1_stride1:11.6341,0,miopenConvolutionBwdWeightsAlgoGEMM;ConvDirectNaiveConvWrw:868.45,0,miopenConvolutionBwdWeightsAlgoDirect
64-3-128-128-3x3x3-64-3-128-128-32-1x1x1-1x1x1-1x1x1-0-NCDHW-FP16-B_g64=GemmBwdRest:105.479,169869312,miopenConvolutionBwdDataAlgoGEMM;ConvDirectNaiveConvBwd:68.534,0,miopenConvolutionBwdDataAlgoDirect
64-3-128-128-3x3x3-64-3-128-128-32-1x1x1-1x1x1-1x1x1-0-NCDHW-FP16-W_g64=GemmWrwUniversal:92.609,169869312,miopenConvolutionBwdWeightsAlgoGEMM;ConvDirectNaiveConvWrw:286.711,0,miopenConvolutionBwdWeightsAlgoDirect
64-3-128-128-3x3x3-1-3-128-128-32-1x1x1-1x1x1-1x1x1-0-NCDHW-FP16-W=GemmWrwUniversal:18.0418,2654208,miopenConvolutionBwdWeightsAlgoGEMM;ConvDirectNaiveConvWrw:349.601,0,miopenConvolutionBwdWeightsAlgoDirect
16-3-128-128-1x1x1-64-3-128-128-32-0x0x0-1x1x1-1x1x1-0-NCDHW-FP16-B=GemmBwd1x1_stride1:1.28352,0,miopenConvolutionBwdDataAlgoGEMM;ConvDirectNaiveConvBwd:67.3043,0,miopenConvolutionBwdDataAlgoDirect
16-3-128-128-1x1x1-64-3-128-128-32-0x0x0-1x1x1-1x1x1-0-NCDHW-FP16-W=GemmWrw1x1_stride1:22.4719,0,miopenConvolutionBwdWeightsAlgoGEMM;ConvDirectNaiveConvWrw:446.611,0,miopenConvolutionBwdWeightsAlgoDirect
16-3-128-128-3x3x3-64-3-128-128-32-1x1x1-1x1x1-1x1x1-0-NCDHW-FP16-B=GemmBwdRest:56.1752,169869312,miopenConvolutionBwdDataAlgoGEMM;ConvDirectNaiveConvBwd:1033.64,0,miopenConvolutionBwdDataAlgoDirect
16-3-128-128-3x3x3-64-3-128-128-32-1x1x1-1x1x1-1x1x1-0-NCDHW-FP16-W=GemmWrwUniversal:94.99,169869312,miopenConvolutionBwdWeightsAlgoGEMM;ConvDirectNaiveConvWrw:1300.2,0,miopenConvolutionBwdWeightsAlgoDirect
64-3-128-128-3x3x3-9-3-128-128-32-1x1x1-1x1x1-1x1x1-0-NCDHW-FP16-W=GemmWrwUniversal:21.9429,23887872,miopenConvolutionBwdWeightsAlgoGEMM;ConvDirectNaiveConvWrw:500.413,0,miopenConvolutionBwdWeightsAlgoDirect
9-3-128-128-3x3x3-64-3-128-128-24-1x1x1-1x1x1-1x1x1-0-NCDHW-FP16-F=GemmFwdRest:17.1496,23887872,miopenConvolutionFwdAlgoGEMM;ConvDirectNaiveConvFwd:282.991,0,miopenConvolutionFwdAlgoDirect
64-3-128-128-3x3x3-16-3-128-128-24-1x1x1-1x1x1-1x1x1-0-NCDHW-FP16-F=GemmFwdRest:66.0433,169869312,miopenConvolutionFwdAlgoGEMM;ConvDirectNaiveConvFwd:500.378,0,miopenConvolutionFwdAlgoDirect
64-3-128-128-1x1x1-16-3-128-128-24-0x0x0-1x1x1-1x1x1-0-NCDHW-FP16-F=GemmFwd1x1_0_1:1.04902,0,miopenConvolutionFwdAlgoGEMM;ConvDirectNaiveConvFwd:30.0974,0,miopenConvolutionFwdAlgoDirect
64-3-128-128-1x1x1-64-3-128-128-24-0x0x0-1x1x1-1x1x1-0-NCDHW-FP16-F=GemmFwd1x1_0_1:1.17274,0,miopenConvolutionFwdAlgoGEMM;ConvDirectNaiveConvFwd:108.371,0,miopenConvolutionFwdAlgoDirect
1-3-128-128-3x3x3-64-3-128-128-24-1x1x1-1x1x1-1x1x1-0-NCDHW-FP16-F=GemmFwdRest:3.12337,2654208,miopenConvolutionFwdAlgoGEMM;ConvDirectNaiveConvFwd:30.3358,0,miopenConvolutionFwdAlgoDirect
64-3-128-128-3x3x3-64-3-128-128-24-1x1x1-1x1x1-1x1x1-0-NCDHW-FP16-F_g64=GemmFwdRest:114.702,169869312,miopenConvolutionFwdAlgoGEMM;ConvDirectNaiveConvFwd:30.3318,0,miopenConvolutionFwdAlgoDirect
64-3-128-128-1x1x1-128-3-128-128-24-0x0x0-1x1x1-1x1x1-0-NCDHW-FP16-F=GemmFwd1x1_0_1:1.57289,0,miopenConvolutionFwdAlgoGEMM;ConvDirectNaiveConvFwd:215.223,0,miopenConvolutionFwdAlgoDirect
64-3-128-128-3x3x3-64-3-128-128-24-1x1x1-1x1x1-1x1x1-0-NCDHW-FP16-F=GemmFwdRest:67.5492,169869312,miopenConvolutionFwdAlgoGEMM;ConvDirectNaiveConvFwd:1830.65,0,miopenConvolutionFwdAlgoDirect
64-3-128-128-1x1x1-32-3-128-128-24-0x0x0-1x1x1-1x1x1-0-NCDHW-FP16-F=GemmFwd1x1_0_1:1.33633,0,miopenConvolutionFwdAlgoGEMM;ConvDirectNaiveConvFwd:92.939,0,miopenConvolutionFwdAlgoDirect
64-3-128-128-3x3x3-1-3-128-128-24-1x1x1-1x1x1-1x1x1-0-NCDHW-FP16-F=GemmFwdRest:69.5722,169869312,miopenConvolutionFwdAlgoGEMM;ConvDirectNaiveConvFwd:63.9481,0,miopenConvolutionFwdAlgoDirect
1-128-128-11x11-1-128-128-72-5x5-1x1-1x1-0-NCHW-FP16-F=GemmFwdRest:4.69146,3964928,miopenConvolutionFwdAlgoGEMM;ConvDirectNaiveConvFwd:5.41182,0,miopenConvolutionFwdAlgoDirect
1-132-132-5x5-1-128-128-72-0x0-1x1-1x1-0-NCHW-FP16-F=GemmFwdRest:3.13324,819200,miopenConvolutionFwdAlgoGEMM;ConvDirectNaiveConvFwd:1.17192,0,miopenConvolutionFwdAlgoDirect
1-128-128-5x5-1-132-132-72-0x0-1x1-1x1-0-NCHW-FP16-B=GemmBwdRest:3.50674,819200,miopenConvolutionBwdDataAlgoGEMM;ConvDirectNaiveConvBwd:1.81411,0,miopenConvolutionBwdDataAlgoDirect
1-128-128-11x11-1-128-128-72-5x5-1x1-1x1-0-NCHW-FP16-B=GemmBwdRest:6.00037,3964928,miopenConvolutionBwdDataAlgoGEMM;ConvDirectNaiveConvBwd:7.84603,0,miopenConvolutionBwdDataAlgoDirect
1-3-128-128-3x3x3-64-3-128-128-24-1x1x1-1x1x1-1x1x1-0-NCDHW-FP16-B=GemmBwdRest:43.0287,169869312,miopenConvolutionBwdDataAlgoGEMM;ConvDirectNaiveConvBwd:83.3405,0,miopenConvolutionBwdDataAlgoDirect
1-3-128-128-3x3x3-64-3-128-128-24-1x1x1-1x1x1-1x1x1-0-NCDHW-FP16-W=GemmWrwUniversal:71.2336,169869312,miopenConvolutionBwdWeightsAlgoGEMM;ConvDirectNaiveConvWrw:2256.95,0,miopenConvolutionBwdWeightsAlgoDirect
64-3-128-128-3x3x3-64-3-128-128-24-1x1x1-1x1x1-1x1x1-0-NCDHW-FP16-B=GemmBwdRest:43.0165,169869312,miopenConvolutionBwdDataAlgoGEMM;ConvDirectNaiveConvBwd:3095.57,0,miopenConvolutionBwdDataAlgoDirect
64-3-128-128-3x3x3-64-3-128-128-24-1x1x1-1x1x1-1x1x1-0-NCDHW-FP16-W=GemmWrwUniversal:71.5711,169869312,miopenConvolutionBwdWeightsAlgoGEMM;ConvDirectNaiveConvWrw:2755.32,0,miopenConvolutionBwdWeightsAlgoDirect
64-3-128-128-1x1x1-64-3-128-128-24-0x0x0-1x1x1-1x1x1-0-NCDHW-FP16-B=GemmBwd1x1_stride1:1.20855,0,miopenConvolutionBwdDataAlgoGEMM;ConvDirectNaiveConvBwd:200.707,0,miopenConvolutionBwdDataAlgoDirect
64-3-128-128-1x1x1-64-3-128-128-24-0x0x0-1x1x1-1x1x1-0-NCDHW-FP16-W=GemmWrw1x1_stride1:9.01925,0,miopenConvolutionBwdWeightsAlgoGEMM;ConvDirectNaiveConvWrw:256.957,0,miopenConvolutionBwdWeightsAlgoDirect
32-3-128-128-1x1x1-64-3-128-128-24-0x0x0-1x1x1-1x1x1-0-NCDHW-FP16-B=GemmBwd1x1_stride1:1.01946,0,miopenConvolutionBwdDataAlgoGEMM;ConvDirectNaiveConvBwd:99.3593,0,miopenConvolutionBwdDataAlgoDirect
32-3-128-128-1x1x1-64-3-128-128-24-0x0x0-1x1x1-1x1x1-0-NCDHW-FP16-W=GemmWrw1x1_stride1:9.56032,0,miopenConvolutionBwdWeightsAlgoGEMM;ConvDirectNaiveConvWrw:654.709,0,miopenConvolutionBwdWeightsAlgoDirect
128-3-128-128-1x1x1-64-3-128-128-24-0x0x0-1x1x1-1x1x1-0-NCDHW-FP16-B=GemmBwd1x1_stride1:1.59008,0,miopenConvolutionBwdDataAlgoGEMM;ConvDirectNaiveConvBwd:407.331,0,miopenConvolutionBwdDataAlgoDirect
128-3-128-128-1x1x1-64-3-128-128-24-0x0x0-1x1x1-1x1x1-0-NCDHW-FP16-W=GemmWrw1x1_stride1:7.16618,0,miopenConvolutionBwdWeightsAlgoGEMM;ConvDirectNaiveConvWrw:584.077,0,miopenConvolutionBwdWeightsAlgoDirect
64-3-128-128-3x3x3-64-3-128-128-24-1x1x1-1x1x1-1x1x1-0-NCDHW-FP16-B_g64=GemmBwdRest:76.8267,169869312,miopenConvolutionBwdDataAlgoGEMM;ConvDirectNaiveConvBwd:50.6234,0,miopenConvolutionBwdDataAlgoDirect
64-3-128-128-3x3x3-64-3-128-128-24-1x1x1-1x1x1-1x1x1-0-NCDHW-FP16-W_g64=GemmWrwUniversal:69.2379,169869312,miopenConvolutionBwdWeightsAlgoGEMM;ConvDirectNaiveConvWrw:234.006,0,miopenConvolutionBwdWeightsAlgoDirect
64-3-128-128-3x3x3-1-3-128-128-24-1x1x1-1x1x1-1x1x1-0-NCDHW-FP16-W=GemmWrwUniversal:13.5204,2654208,miopenConvolutionBwdWeightsAlgoGEMM;ConvDirectNaiveConvWrw:391.047,0,miopenConvolutionBwdWeightsAlgoDirect
16-3-128-128-1x1x1-64-3-128-128-24-0x0x0-1x1x1-1x1x1-0-NCDHW-FP16-B=GemmBwd1x1_stride1:1.0558,0,miopenConvolutionBwdDataAlgoGEMM;ConvDirectNaiveConvBwd:50.6213,0,miopenConvolutionBwdDataAlgoDirect
16-3-128-128-1x1x1-64-3-128-128-24-0x0x0-1x1x1-1x1x1-0-NCDHW-FP16-W=GemmWrw1x1_stride1:10.7794,0,miopenConvolutionBwdWeightsAlgoGEMM;ConvDirectNaiveConvWrw:319.645,0,miopenConvolutionBwdWeightsAlgoDirect
16-3-128-128-3x3x3-64-3-128-128-24-1x1x1-1x1x1-1x1x1-0-NCDHW-FP16-B=GemmBwdRest:41.8423,169869312,miopenConvolutionBwdDataAlgoGEMM;ConvDirectNaiveConvBwd:775.853,0,miopenConvolutionBwdDataAlgoDirect
16-3-128-128-3x3x3-64-3-128-128-24-1x1x1-1x1x1-1x1x1-0-NCDHW-FP16-W=GemmWrwUniversal:69.9976,169869312,miopenConvolutionBwdWeightsAlgoGEMM;ConvDirectNaiveConvWrw:1052.85,0,miopenConvolutionBwdWeightsAlgoDirect
64-3-128-128-3x3x3-9-3-128-128-24-1x1x1-1x1x1-1x1x1-0-NCDHW-FP16-W=GemmWrwUniversal:16.3466,23887872,miopenConvolutionBwdWeightsAlgoGEMM;ConvDirectNaiveConvWrw:520.827,0,miopenConvolutionBwdWeightsAlgoDirect
