miopen_cache/gfx1200_16.HIP.3_5_1_5b515cf1bc.ufdb.txt
9-3-128-128-3x3x3-64-3-128-128-32-1x1x1-1x1x1-1x1x1-0-NCDHW-FP16-F=GemmFwdRest:27.1387,23887872,miopenConvolutionFwdAlgoGEMM;ConvDirectNaiveConvFwd:371.444,0,miopenConvolutionFwdAlgoDirect
64-3-128-128-3x3x3-16-3-128-128-32-1x1x1-1x1x1-1x1x1-0-NCDHW-FP16-F=GemmFwdRest:102.014,169869312,miopenConvolutionFwdAlgoGEMM;ConvDirectNaiveConvFwd:648.234,0,miopenConvolutionFwdAlgoDirect
64-3-128-128-1x1x1-16-3-128-128-32-0x0x0-1x1x1-1x1x1-0-NCDHW-FP16-F=GemmFwd1x1_0_1:1.48658,0,miopenConvolutionFwdAlgoGEMM;ConvDirectNaiveConvFwd:38.047,0,miopenConvolutionFwdAlgoDirect
64-3-128-128-1x1x1-64-3-128-128-32-0x0x0-1x1x1-1x1x1-0-NCDHW-FP16-F=GemmFwd1x1_0_1:1.60201,0,miopenConvolutionFwdAlgoGEMM;ConvDirectNaiveConvFwd:143.483,0,miopenConvolutionFwdAlgoDirect
1-3-128-128-3x3x3-64-3-128-128-32-1x1x1-1x1x1-1x1x1-0-NCDHW-FP16-F=GemmFwdRest:4.32886,2654208,miopenConvolutionFwdAlgoGEMM;ConvDirectNaiveConvFwd:40.3635,0,miopenConvolutionFwdAlgoDirect
64-3-128-128-3x3x3-64-3-128-128-32-1x1x1-1x1x1-1x1x1-0-NCDHW-FP16-F=GemmFwdRest:103.165,169869312,miopenConvolutionFwdAlgoGEMM;ConvDirectNaiveConvFwd:2431.84,0,miopenConvolutionFwdAlgoDirect
64-3-128-128-3x3x3-128-3-128-128-32-1x1x1-1x1x1-1x1x1-0-NCDHW-FP16-F=GemmFwdRest:104.933,169869312,miopenConvolutionFwdAlgoGEMM;ConvDirectNaiveConvFwd:4847.86,0,miopenConvolutionFwdAlgoDirect
64-1-1-1-1x1x1-64-1-1-1-764163-0x0x0-1x1x1-1x1x1-0-NCDHW-FP16-F=GemmFwd1x1_0_1:22.793,0,miopenConvolutionFwdAlgoGEMM;ConvDirectNaiveConvFwd:2855.9,0,miopenConvolutionFwdAlgoDirect
64-1-1-1-1x1x1-64-1-1-1-559971-0x0x0-1x1x1-1x1x1-0-NCDHW-FP16-F=GemmFwd1x1_0_1:17.1383,0,miopenConvolutionFwdAlgoGEMM;ConvDirectNaiveConvFwd:424.543,0,miopenConvolutionFwdAlgoDirect
64-1-1-1-1x1x1-64-1-1-1-248730-0x0x0-1x1x1-1x1x1-0-NCDHW-FP16-F=GemmFwd1x1_0_1:7.89928,0,miopenConvolutionFwdAlgoGEMM;ConvDirectNaiveConvFwd:2961.38,0,miopenConvolutionFwdAlgoDirect
64-3-128-128-1x1x1-32-3-128-128-32-0x0x0-1x1x1-1x1x1-0-NCDHW-FP16-F=GemmFwd1x1_0_1:1.50876,0,miopenConvolutionFwdAlgoGEMM;ConvDirectNaiveConvFwd:72.6782,0,miopenConvolutionFwdAlgoDirect
64-3-128-128-1x1x1-128-3-128-128-32-0x0x0-1x1x1-1x1x1-0-NCDHW-FP16-F=GemmFwd1x1_0_1:2.10538,0,miopenConvolutionFwdAlgoGEMM;ConvDirectNaiveConvFwd:285.057,0,miopenConvolutionFwdAlgoDirect
64-3-128-128-3x3x3-64-3-128-128-32-1x1x1-1x1x1-1x1x1-0-NCDHW-FP16-F_g64=GemmFwdRest:172.01,169869312,miopenConvolutionFwdAlgoGEMM;ConvDirectNaiveConvFwd:40.269,0,miopenConvolutionFwdAlgoDirect
64-3-128-128-3x3x3-1-3-128-128-32-1x1x1-1x1x1-1x1x1-0-NCDHW-FP16-F=GemmFwdRest:101.463,169869312,miopenConvolutionFwdAlgoGEMM;ConvDirectNaiveConvFwd:57.0132,0,miopenConvolutionFwdAlgoDirect
1-128-128-11x11-1-128-128-96-5x5-1x1-1x1-0-NCHW-FP16-F=GemmFwdRest:6.40953,3964928,miopenConvolutionFwdAlgoGEMM;ConvDirectNaiveConvFwd:6.31939,0,miopenConvolutionFwdAlgoDirect
1-132-132-5x5-1-128-128-96-0x0-1x1-1x1-0-NCHW-FP16-F=GemmFwdRest:4.23977,819200,miopenConvolutionFwdAlgoGEMM;ConvDirectNaiveConvFwd:1.41938,0,miopenConvolutionFwdAlgoDirect
1-128-128-5x5-1-132-132-96-0x0-1x1-1x1-0-NCHW-FP16-B=GemmBwdRest:4.03166,819200,miopenConvolutionBwdDataAlgoGEMM;ConvDirectNaiveConvBwd:2.20364,0,miopenConvolutionBwdDataAlgoDirect
1-128-128-11x11-1-128-128-96-5x5-1x1-1x1-0-NCHW-FP16-B=GemmBwdRest:7.70626,3964928,miopenConvolutionBwdDataAlgoGEMM;ConvDirectNaiveConvBwd:9.50266,0,miopenConvolutionBwdDataAlgoDirect
1-3-128-128-3x3x3-64-3-128-128-32-1x1x1-1x1x1-1x1x1-0-NCDHW-FP16-B=GemmBwdRest:46.6016,169869312,miopenConvolutionBwdDataAlgoGEMM;ConvDirectNaiveConvBwd:95.3818,0,miopenConvolutionBwdDataAlgoDirect
1-3-128-128-3x3x3-64-3-128-128-32-1x1x1-1x1x1-1x1x1-0-NCDHW-FP16-W=GemmWrwUniversal:106.275,169869312,miopenConvolutionBwdWeightsAlgoGEMM;ConvDirectNaiveConvWrw:2261.74,0,miopenConvolutionBwdWeightsAlgoDirect
64-3-128-128-3x3x3-64-3-128-128-32-1x1x1-1x1x1-1x1x1-0-NCDHW-FP16-B=GemmBwdRest:48.7227,169869312,miopenConvolutionBwdDataAlgoGEMM;ConvDirectNaiveConvBwd:4113.88,0,miopenConvolutionBwdDataAlgoDirect
64-3-128-128-3x3x3-64-3-128-128-32-1x1x1-1x1x1-1x1x1-0-NCDHW-FP16-W=GemmWrwUniversal:110.681,169869312,miopenConvolutionBwdWeightsAlgoGEMM;ConvDirectNaiveConvWrw:3358.78,0,miopenConvolutionBwdWeightsAlgoDirect
64-3-128-128-1x1x1-64-3-128-128-32-0x0x0-1x1x1-1x1x1-0-NCDHW-FP16-B=GemmBwd1x1_stride1:1.58784,0,miopenConvolutionBwdDataAlgoGEMM;ConvDirectNaiveConvBwd:261.635,0,miopenConvolutionBwdDataAlgoDirect
64-3-128-128-1x1x1-64-3-128-128-32-0x0x0-1x1x1-1x1x1-0-NCDHW-FP16-W=GemmWrw1x1_stride1:9.93946,0,miopenConvolutionBwdWeightsAlgoGEMM;ConvDirectNaiveConvWrw:319.354,0,miopenConvolutionBwdWeightsAlgoDirect
64-3-128-128-3x3x3-64-3-128-128-32-1x1x1-1x1x1-1x1x1-0-NCDHW-FP16-B_g64=GemmBwdRest:73.4932,169869312,miopenConvolutionBwdDataAlgoGEMM;ConvDirectNaiveConvBwd:66.5239,0,miopenConvolutionBwdDataAlgoDirect
64-3-128-128-3x3x3-64-3-128-128-32-1x1x1-1x1x1-1x1x1-0-NCDHW-FP16-W_g64=GemmWrwUniversal:105.781,169869312,miopenConvolutionBwdWeightsAlgoGEMM;ConvDirectNaiveConvWrw:263.957,0,miopenConvolutionBwdWeightsAlgoDirect
128-3-128-128-1x1x1-64-3-128-128-32-0x0x0-1x1x1-1x1x1-0-NCDHW-FP16-B=GemmBwd1x1_stride1:2.21991,0,miopenConvolutionBwdDataAlgoGEMM;ConvDirectNaiveConvBwd:521.997,0,miopenConvolutionBwdDataAlgoDirect
128-3-128-128-1x1x1-64-3-128-128-32-0x0x0-1x1x1-1x1x1-0-NCDHW-FP16-W=GemmWrw1x1_stride1:9.46419,0,miopenConvolutionBwdWeightsAlgoGEMM;ConvDirectNaiveConvWrw:765.792,0,miopenConvolutionBwdWeightsAlgoDirect
32-3-128-128-1x1x1-64-3-128-128-32-0x0x0-1x1x1-1x1x1-0-NCDHW-FP16-B=GemmBwd1x1_stride1:1.14042,0,miopenConvolutionBwdDataAlgoGEMM;ConvDirectNaiveConvBwd:132.055,0,miopenConvolutionBwdDataAlgoDirect
32-3-128-128-1x1x1-64-3-128-128-32-0x0x0-1x1x1-1x1x1-0-NCDHW-FP16-W=GemmWrw1x1_stride1:9.38663,0,miopenConvolutionBwdWeightsAlgoGEMM;ConvDirectNaiveConvWrw:203.357,0,miopenConvolutionBwdWeightsAlgoDirect
64-1-1-1-1x1x1-64-1-1-1-248730-0x0x0-1x1x1-1x1x1-0-NCDHW-FP16-B=GemmBwd1x1_stride1:12.9438,0,miopenConvolutionBwdDataAlgoGEMM;ConvDirectNaiveConvBwd:5282.62,0,miopenConvolutionBwdDataAlgoDirect
64-1-1-1-1x1x1-64-1-1-1-248730-0x0x0-1x1x1-1x1x1-0-NCDHW-FP16-W=GemmWrw1x1_stride1:1523.84,0,miopenConvolutionBwdWeightsAlgoGEMM;ConvDirectNaiveConvWrw:87.2765,0,miopenConvolutionBwdWeightsAlgoDirect
64-1-1-1-1x1x1-64-1-1-1-559971-0x0x0-1x1x1-1x1x1-0-NCDHW-FP16-B=GemmBwd1x1_stride1:27.6479,0,miopenConvolutionBwdDataAlgoGEMM;ConvDirectNaiveConvBwd:757.633,0,miopenConvolutionBwdDataAlgoDirect
64-1-1-1-1x1x1-64-1-1-1-559971-0x0x0-1x1x1-1x1x1-0-NCDHW-FP16-W=GemmWrw1x1_stride1:3601.55,0,miopenConvolutionBwdWeightsAlgoGEMM;ConvDirectNaiveConvWrw:199.165,0,miopenConvolutionBwdWeightsAlgoDirect
64-1-1-1-1x1x1-64-1-1-1-764163-0x0x0-1x1x1-1x1x1-0-NCDHW-FP16-B=GemmBwd1x1_stride1:37.5752,0,miopenConvolutionBwdDataAlgoGEMM;ConvDirectNaiveConvBwd:5125.04,0,miopenConvolutionBwdDataAlgoDirect
64-1-1-1-1x1x1-64-1-1-1-764163-0x0x0-1x1x1-1x1x1-0-NCDHW-FP16-W=GemmWrw1x1_stride1:4895.7,0,miopenConvolutionBwdWeightsAlgoGEMM;ConvDirectNaiveConvWrw:271.742,0,miopenConvolutionBwdWeightsAlgoDirect
128-3-128-128-3x3x3-64-3-128-128-32-1x1x1-1x1x1-1x1x1-0-NCDHW-FP16-B=GemmBwdRest:52.9603,169869312,miopenConvolutionBwdDataAlgoGEMM;ConvDirectNaiveConvBwd:8219.13,0,miopenConvolutionBwdDataAlgoDirect
128-3-128-128-3x3x3-64-3-128-128-32-1x1x1-1x1x1-1x1x1-0-NCDHW-FP16-W=GemmWrwUniversal:131.009,169869312,miopenConvolutionBwdWeightsAlgoGEMM;ConvDirectNaiveConvWrw:6224.42,0,miopenConvolutionBwdWeightsAlgoDirect
64-3-128-128-3x3x3-1-3-128-128-32-1x1x1-1x1x1-1x1x1-0-NCDHW-FP16-W=GemmWrwUniversal:11.801,2654208,miopenConvolutionBwdWeightsAlgoGEMM;ConvDirectNaiveConvWrw:282.941,0,miopenConvolutionBwdWeightsAlgoDirect
16-3-128-128-1x1x1-64-3-128-128-32-0x0x0-1x1x1-1x1x1-0-NCDHW-FP16-B=GemmBwd1x1_stride1:0.905796,0,miopenConvolutionBwdDataAlgoGEMM;ConvDirectNaiveConvBwd:67.2462,0,miopenConvolutionBwdDataAlgoDirect
16-3-128-128-1x1x1-64-3-128-128-32-0x0x0-1x1x1-1x1x1-0-NCDHW-FP16-W=GemmWrw1x1_stride1:9.78715,0,miopenConvolutionBwdWeightsAlgoGEMM;ConvDirectNaiveConvWrw:199.669,0,miopenConvolutionBwdWeightsAlgoDirect
16-3-128-128-3x3x3-64-3-128-128-32-1x1x1-1x1x1-1x1x1-0-NCDHW-FP16-B=GemmBwdRest:45.4961,169869312,miopenConvolutionBwdDataAlgoGEMM;ConvDirectNaiveConvBwd:1031.25,0,miopenConvolutionBwdDataAlgoDirect
16-3-128-128-3x3x3-64-3-128-128-32-1x1x1-1x1x1-1x1x1-0-NCDHW-FP16-W=GemmWrwUniversal:110.832,169869312,miopenConvolutionBwdWeightsAlgoGEMM;ConvDirectNaiveConvWrw:1323.82,0,miopenConvolutionBwdWeightsAlgoDirect
64-3-128-128-3x3x3-9-3-128-128-32-1x1x1-1x1x1-1x1x1-0-NCDHW-FP16-W=GemmWrwUniversal:22.8751,23887872,miopenConvolutionBwdWeightsAlgoGEMM;ConvDirectNaiveConvWrw:480.441,0,miopenConvolutionBwdWeightsAlgoDirect
64-1-1-1-1x1x1-64-1-1-1-823806-0x0x0-1x1x1-1x1x1-0-NCDHW-FP16-F=GemmFwd1x1_0_1:24.9201,0,miopenConvolutionFwdAlgoGEMM;ConvDirectNaiveConvFwd:448.393,0,miopenConvolutionFwdAlgoDirect
64-1-1-1-1x1x1-64-1-1-1-418328-0x0x0-1x1x1-1x1x1-0-NCDHW-FP16-F=GemmFwd1x1_0_1:13.0928,0,miopenConvolutionFwdAlgoGEMM;ConvDirectNaiveConvFwd:1875.19,0,miopenConvolutionFwdAlgoDirect
64-1-1-1-1x1x1-64-1-1-1-330730-0x0x0-1x1x1-1x1x1-0-NCDHW-FP16-F=GemmFwd1x1_0_1:10.4813,0,miopenConvolutionFwdAlgoGEMM;ConvDirectNaiveConvFwd:816.508,0,miopenConvolutionFwdAlgoDirect
64-1-1-1-1x1x1-64-1-1-1-330730-0x0x0-1x1x1-1x1x1-0-NCDHW-FP16-B=GemmBwd1x1_stride1:17.0456,0,miopenConvolutionBwdDataAlgoGEMM;ConvDirectNaiveConvBwd:1474.01,0,miopenConvolutionBwdDataAlgoDirect
64-1-1-1-1x1x1-64-1-1-1-330730-0x0x0-1x1x1-1x1x1-0-NCDHW-FP16-W=GemmWrw1x1_stride1:2133.37,0,miopenConvolutionBwdWeightsAlgoGEMM;ConvDirectNaiveConvWrw:117.68,0,miopenConvolutionBwdWeightsAlgoDirect
64-1-1-1-1x1x1-64-1-1-1-418328-0x0x0-1x1x1-1x1x1-0-NCDHW-FP16-B=GemmBwd1x1_stride1:21.2308,0,miopenConvolutionBwdDataAlgoGEMM;ConvDirectNaiveConvBwd:3318.75,0,miopenConvolutionBwdDataAlgoDirect
64-1-1-1-1x1x1-64-1-1-1-418328-0x0x0-1x1x1-1x1x1-0-NCDHW-FP16-W=GemmWrw1x1_stride1:2698.21,0,miopenConvolutionBwdWeightsAlgoGEMM;ConvDirectNaiveConvWrw:149.137,0,miopenConvolutionBwdWeightsAlgoDirect
64-1-1-1-1x1x1-64-1-1-1-823806-0x0x0-1x1x1-1x1x1-0-NCDHW-FP16-B=GemmBwd1x1_stride1:39.2527,0,miopenConvolutionBwdDataAlgoGEMM;ConvDirectNaiveConvBwd:794.048,0,miopenConvolutionBwdDataAlgoDirect
64-1-1-1-1x1x1-64-1-1-1-823806-0x0x0-1x1x1-1x1x1-0-NCDHW-FP16-W=GemmWrw1x1_stride1:5210.03,0,miopenConvolutionBwdWeightsAlgoGEMM;ConvDirectNaiveConvWrw:293.935,0,miopenConvolutionBwdWeightsAlgoDirect
64-1-1-1-1x1x1-64-1-1-1-971009-0x0x0-1x1x1-1x1x1-0-NCDHW-FP16-F=GemmFwd1x1_0_1:28.7623,0,miopenConvolutionFwdAlgoGEMM;ConvDirectNaiveConvFwd:2196.95,0,miopenConvolutionFwdAlgoDirect
64-1-1-1-1x1x1-64-1-1-1-534692-0x0x0-1x1x1-1x1x1-0-NCDHW-FP16-F=GemmFwd1x1_0_1:16.5347,0,miopenConvolutionFwdAlgoGEMM;ConvDirectNaiveConvFwd:123.872,0,miopenConvolutionFwdAlgoDirect
64-1-1-1-1x1x1-64-1-1-1-67163-0x0x0-1x1x1-1x1x1-0-NCDHW-FP16-F=GemmFwd1x1_0_1:2.15106,0,miopenConvolutionFwdAlgoGEMM;ConvDirectNaiveConvFwd:799.551,0,miopenConvolutionFwdAlgoDirect
64-1-1-1-1x1x1-64-1-1-1-67163-0x0x0-1x1x1-1x1x1-0-NCDHW-FP16-B=GemmBwd1x1_stride1:3.59191,0,miopenConvolutionBwdDataAlgoGEMM;ConvDirectNaiveConvBwd:1440.71,0,miopenConvolutionBwdDataAlgoDirect
64-1-1-1-1x1x1-64-1-1-1-67163-0x0x0-1x1x1-1x1x1-0-NCDHW-FP16-W=GemmWrw1x1_stride1:430.347,0,miopenConvolutionBwdWeightsAlgoGEMM;ConvDirectNaiveConvWrw:20.7888,0,miopenConvolutionBwdWeightsAlgoDirect
64-1-1-1-1x1x1-64-1-1-1-534692-0x0x0-1x1x1-1x1x1-0-NCDHW-FP16-B=GemmBwd1x1_stride1:27.0555,0,miopenConvolutionBwdDataAlgoGEMM;ConvDirectNaiveConvBwd:220.945,0,miopenConvolutionBwdDataAlgoDirect
64-1-1-1-1x1x1-64-1-1-1-534692-0x0x0-1x1x1-1x1x1-0-NCDHW-FP16-W=GemmWrw1x1_stride1:3399.35,0,miopenConvolutionBwdWeightsAlgoGEMM;ConvDirectNaiveConvWrw:190.59,0,miopenConvolutionBwdWeightsAlgoDirect
64-1-1-1-1x1x1-64-1-1-1-971009-0x0x0-1x1x1-1x1x1-0-NCDHW-FP16-B=GemmBwd1x1_stride1:46.4815,0,miopenConvolutionBwdDataAlgoGEMM;ConvDirectNaiveConvBwd:3941.75,0,miopenConvolutionBwdDataAlgoDirect
64-1-1-1-1x1x1-64-1-1-1-971009-0x0x0-1x1x1-1x1x1-0-NCDHW-FP16-W=GemmWrw1x1_stride1:6054.04,0,miopenConvolutionBwdWeightsAlgoGEMM;ConvDirectNaiveConvWrw:352.958,0,miopenConvolutionBwdWeightsAlgoDirect
64-1-1-1-1x1x1-64-1-1-1-1161941-0x0x0-1x1x1-1x1x1-0-NCDHW-FP16-F=GemmFwd1x1_0_1:33.8741,0,miopenConvolutionFwdAlgoGEMM;ConvDirectNaiveConvFwd:1350.97,0,miopenConvolutionFwdAlgoDirect
64-1-1-1-1x1x1-64-1-1-1-336160-0x0x0-1x1x1-1x1x1-0-NCDHW-FP16-F=GemmFwd1x1_0_1:10.8943,0,miopenConvolutionFwdAlgoGEMM;ConvDirectNaiveConvFwd:881.501,0,miopenConvolutionFwdAlgoDirect
64-1-1-1-1x1x1-64-1-1-1-74763-0x0x0-1x1x1-1x1x1-0-NCDHW-FP16-F=GemmFwd1x1_0_1:2.49146,0,miopenConvolutionFwdAlgoGEMM;ConvDirectNaiveConvFwd:896.717,0,miopenConvolutionFwdAlgoDirect
64-1-1-1-1x1x1-64-1-1-1-74763-0x0x0-1x1x1-1x1x1-0-NCDHW-FP16-B=GemmBwd1x1_stride1:4.00932,0,miopenConvolutionBwdDataAlgoGEMM;ConvDirectNaiveConvBwd:1595.89,0,miopenConvolutionBwdDataAlgoDirect
64-1-1-1-1x1x1-64-1-1-1-74763-0x0x0-1x1x1-1x1x1-0-NCDHW-FP16-W=GemmWrw1x1_stride1:476.666,0,miopenConvolutionBwdWeightsAlgoGEMM;ConvDirectNaiveConvWrw:22.954,0,miopenConvolutionBwdWeightsAlgoDirect
64-1-1-1-1x1x1-64-1-1-1-336160-0x0x0-1x1x1-1x1x1-0-NCDHW-FP16-B=GemmBwd1x1_stride1:17.5064,0,miopenConvolutionBwdDataAlgoGEMM;ConvDirectNaiveConvBwd:1577.08,0,miopenConvolutionBwdDataAlgoDirect
64-1-1-1-1x1x1-64-1-1-1-336160-0x0x0-1x1x1-1x1x1-0-NCDHW-FP16-W=GemmWrw1x1_stride1:2142.1,0,miopenConvolutionBwdWeightsAlgoGEMM;ConvDirectNaiveConvWrw:120.348,0,miopenConvolutionBwdWeightsAlgoDirect
64-1-1-1-1x1x1-64-1-1-1-1161941-0x0x0-1x1x1-1x1x1-0-NCDHW-FP16-B=GemmBwd1x1_stride1:55.5344,0,miopenConvolutionBwdDataAlgoGEMM;ConvDirectNaiveConvBwd:2424.95,0,miopenConvolutionBwdDataAlgoDirect
64-1-1-1-1x1x1-64-1-1-1-1161941-0x0x0-1x1x1-1x1x1-0-NCDHW-FP16-W=GemmWrw1x1_stride1:7345.32,0,miopenConvolutionBwdWeightsAlgoGEMM;ConvDirectNaiveConvWrw:414.79,0,miopenConvolutionBwdWeightsAlgoDirect
64-1-1-1-1x1x1-64-1-1-1-964506-0x0x0-1x1x1-1x1x1-0-NCDHW-FP16-F=GemmFwd1x1_0_1:28.7299,0,miopenConvolutionFwdAlgoGEMM;ConvDirectNaiveConvFwd:2134.34,0,miopenConvolutionFwdAlgoDirect
64-1-1-1-1x1x1-64-1-1-1-381738-0x0x0-1x1x1-1x1x1-0-NCDHW-FP16-F=GemmFwd1x1_0_1:12.0609,0,miopenConvolutionFwdAlgoGEMM;ConvDirectNaiveConvFwd:1433,0,miopenConvolutionFwdAlgoDirect
64-1-1-1-1x1x1-64-1-1-1-226620-0x0x0-1x1x1-1x1x1-0-NCDHW-FP16-F=GemmFwd1x1_0_1:7.29347,0,miopenConvolutionFwdAlgoGEMM;ConvDirectNaiveConvFwd:2703.02,0,miopenConvolutionFwdAlgoDirect
64-1-1-1-1x1x1-64-1-1-1-859938-0x0x0-1x1x1-1x1x1-0-NCDHW-FP16-F=GemmFwd1x1_0_1:25.7917,0,miopenConvolutionFwdAlgoGEMM;ConvDirectNaiveConvFwd:886.676,0,miopenConvolutionFwdAlgoDirect
64-1-1-1-1x1x1-64-1-1-1-487204-0x0x0-1x1x1-1x1x1-0-NCDHW-FP16-F=GemmFwd1x1_0_1:15.3558,0,miopenConvolutionFwdAlgoGEMM;ConvDirectNaiveConvFwd:2711.33,0,miopenConvolutionFwdAlgoDirect
64-1-1-1-1x1x1-64-1-1-1-225722-0x0x0-1x1x1-1x1x1-0-NCDHW-FP16-F=GemmFwd1x1_0_1:7.2567,0,miopenConvolutionFwdAlgoGEMM;ConvDirectNaiveConvFwd:2701.53,0,miopenConvolutionFwdAlgoDirect
64-1-1-1-1x1x1-64-1-1-1-1121511-0x0x0-1x1x1-1x1x1-0-NCDHW-FP16-F=GemmFwd1x1_0_1:34.3092,0,miopenConvolutionFwdAlgoGEMM;ConvDirectNaiveConvFwd:867.867,0,miopenConvolutionFwdAlgoDirect
64-1-1-1-1x1x1-64-1-1-1-352088-0x0x0-1x1x1-1x1x1-0-NCDHW-FP16-F=GemmFwd1x1_0_1:11.1788,0,miopenConvolutionFwdAlgoGEMM;ConvDirectNaiveConvFwd:1070.2,0,miopenConvolutionFwdAlgoDirect
64-1-1-1-1x1x1-64-1-1-1-99265-0x0x0-1x1x1-1x1x1-0-NCDHW-FP16-F=GemmFwd1x1_0_1:3.19262,0,miopenConvolutionFwdAlgoGEMM;ConvDirectNaiveConvFwd:1184.14,0,miopenConvolutionFwdAlgoDirect
64-1-1-1-1x1x1-64-1-1-1-844207-0x0x0-1x1x1-1x1x1-0-NCDHW-FP16-F=GemmFwd1x1_0_1:25.5834,0,miopenConvolutionFwdAlgoGEMM;ConvDirectNaiveConvFwd:686.403,0,miopenConvolutionFwdAlgoDirect
64-1-1-1-1x1x1-64-1-1-1-510111-0x0x0-1x1x1-1x1x1-0-NCDHW-FP16-F=GemmFwd1x1_0_1:15.9625,0,miopenConvolutionFwdAlgoGEMM;ConvDirectNaiveConvFwd:2946.93,0,miopenConvolutionFwdAlgoDirect
64-1-1-1-1x1x1-64-1-1-1-218546-0x0x0-1x1x1-1x1x1-0-NCDHW-FP16-F=GemmFwd1x1_0_1:7.04587,0,miopenConvolutionFwdAlgoGEMM;ConvDirectNaiveConvFwd:2596.76,0,miopenConvolutionFwdAlgoDirect
64-1-1-1-1x1x1-64-1-1-1-849447-0x0x0-1x1x1-1x1x1-0-NCDHW-FP16-F=GemmFwd1x1_0_1:25.5346,0,miopenConvolutionFwdAlgoGEMM;ConvDirectNaiveConvFwd:748.793,0,miopenConvolutionFwdAlgoDirect
64-1-1-1-1x1x1-64-1-1-1-513392-0x0x0-1x1x1-1x1x1-0-NCDHW-FP16-F=GemmFwd1x1_0_1:16.0347,0,miopenConvolutionFwdAlgoGEMM;ConvDirectNaiveConvFwd:2985.27,0,miopenConvolutionFwdAlgoDirect
64-1-1-1-1x1x1-64-1-1-1-210025-0x0x0-1x1x1-1x1x1-0-NCDHW-FP16-F=GemmFwd1x1_0_1:6.77947,0,miopenConvolutionFwdAlgoGEMM;ConvDirectNaiveConvFwd:2495.71,0,miopenConvolutionFwdAlgoDirect
64-1-1-1-1x1x1-64-1-1-1-1233067-0x0x0-1x1x1-1x1x1-0-NCDHW-FP16-F=GemmFwd1x1_0_1:36.8335,0,miopenConvolutionFwdAlgoGEMM;ConvDirectNaiveConvFwd:2251.31,0,miopenConvolutionFwdAlgoDirect
64-1-1-1-1x1x1-64-1-1-1-2130-0x0x0-1x1x1-1x1x1-0-NCDHW-FP16-F=GemmFwd1x1_0_1:0.0709801,0,miopenConvolutionFwdAlgoGEMM;ConvDirectNaiveConvFwd:28.9247,0,miopenConvolutionFwdAlgoDirect
64-1-1-1-1x1x1-64-1-1-1-337667-0x0x0-1x1x1-1x1x1-0-NCDHW-FP16-F=GemmFwd1x1_0_1:10.5537,0,miopenConvolutionFwdAlgoGEMM;ConvDirectNaiveConvFwd:972.65,0,miopenConvolutionFwdAlgoDirect
64-1-1-1-1x1x1-64-1-1-1-520032-0x0x0-1x1x1-1x1x1-0-NCDHW-FP16-F=GemmFwd1x1_0_1:15.9325,0,miopenConvolutionFwdAlgoGEMM;ConvDirectNaiveConvFwd:3090.76,0,miopenConvolutionFwdAlgoDirect
64-1-1-1-1x1x1-64-1-1-1-1050702-0x0x0-1x1x1-1x1x1-0-NCDHW-FP16-F=GemmFwd1x1_0_1:31.6885,0,miopenConvolutionFwdAlgoGEMM;ConvDirectNaiveConvFwd:27.6614,0,miopenConvolutionFwdAlgoDirect
64-1-1-1-1x1x1-64-1-1-1-2130-0x0x0-1x1x1-1x1x1-0-NCDHW-FP16-B=GemmBwd1x1_stride1:0.160519,0,miopenConvolutionBwdDataAlgoGEMM;ConvDirectNaiveConvBwd:81.3699,0,miopenConvolutionBwdDataAlgoDirect
64-1-1-1-1x1x1-64-1-1-1-2130-0x0x0-1x1x1-1x1x1-0-NCDHW-FP16-W=GemmWrw1x1_stride1:13.2091,0,miopenConvolutionBwdWeightsAlgoGEMM;ConvDirectNaiveConvWrw:0.928563,0,miopenConvolutionBwdWeightsAlgoDirect
64-1-1-1-1x1x1-64-1-1-1-1050702-0x0x0-1x1x1-1x1x1-0-NCDHW-FP16-B=GemmBwd1x1_stride1:55.1992,0,miopenConvolutionBwdDataAlgoGEMM;ConvDirectNaiveConvBwd:50.0825,0,miopenConvolutionBwdDataAlgoDirect
64-1-1-1-1x1x1-64-1-1-1-260698-0x0x0-1x1x1-1x1x1-0-NCDHW-FP16-F=GemmFwd1x1_0_1:8.64612,0,miopenConvolutionFwdAlgoGEMM;ConvDirectNaiveConvFwd:3137.13,0,miopenConvolutionFwdAlgoDirect
64-1-1-1-1x1x1-64-1-1-1-544803-0x0x0-1x1x1-1x1x1-0-NCDHW-FP16-F=GemmFwd1x1_0_1:17.3666,0,miopenConvolutionFwdAlgoGEMM;ConvDirectNaiveConvFwd:256.445,0,miopenConvolutionFwdAlgoDirect
64-1-1-1-1x1x1-64-1-1-1-767363-0x0x0-1x1x1-1x1x1-0-NCDHW-FP16-F=GemmFwd1x1_0_1:23.1235,0,miopenConvolutionFwdAlgoGEMM;ConvDirectNaiveConvFwd:2935.15,0,miopenConvolutionFwdAlgoDirect
64-1-1-1-1x1x1-64-1-1-1-767363-0x0x0-1x1x1-1x1x1-0-NCDHW-FP16-B=GemmBwd1x1_stride1:37.4348,0,miopenConvolutionBwdDataAlgoGEMM;ConvDirectNaiveConvBwd:5200.72,0,miopenConvolutionBwdDataAlgoDirect
64-1-1-1-1x1x1-64-1-1-1-767363-0x0x0-1x1x1-1x1x1-0-NCDHW-FP16-W=GemmWrw1x1_stride1:4847.26,0,miopenConvolutionBwdWeightsAlgoGEMM;ConvDirectNaiveConvWrw:273.517,0,miopenConvolutionBwdWeightsAlgoDirect
64-1-1-1-1x1x1-64-1-1-1-544803-0x0x0-1x1x1-1x1x1-0-NCDHW-FP16-B=GemmBwd1x1_stride1:27.1974,0,miopenConvolutionBwdDataAlgoGEMM;ConvDirectNaiveConvBwd:434.447,0,miopenConvolutionBwdDataAlgoDirect
64-1-1-1-1x1x1-64-1-1-1-544803-0x0x0-1x1x1-1x1x1-0-NCDHW-FP16-W=GemmWrw1x1_stride1:3461.89,0,miopenConvolutionBwdWeightsAlgoGEMM;ConvDirectNaiveConvWrw:197.384,0,miopenConvolutionBwdWeightsAlgoDirect
64-1-1-1-1x1x1-64-1-1-1-260698-0x0x0-1x1x1-1x1x1-0-NCDHW-FP16-B=GemmBwd1x1_stride1:13.6717,0,miopenConvolutionBwdDataAlgoGEMM;ConvDirectNaiveConvBwd:5580.11,0,miopenConvolutionBwdDataAlgoDirect
64-1-1-1-1x1x1-64-1-1-1-260698-0x0x0-1x1x1-1x1x1-0-NCDHW-FP16-W=GemmWrw1x1_stride1:1625.89,0,miopenConvolutionBwdWeightsAlgoGEMM;ConvDirectNaiveConvWrw:92.8902,0,miopenConvolutionBwdWeightsAlgoDirect
